{
  "account_id": "acct_patriot_alarm_and_se_548cbce3",
  "company_name": "Patriot Alarm and Security",
  "business_type": "fire protection",
  "business_hours": {
    "days": "Monday through Friday",
    "start": "8:00 AM",
    "end": "5:00 PM",
    "timezone": "Eastern"
  },
  "office_address": "1200 Peachtree Industrial Boulevard, Suite 450, Atlanta, Georgia 30309",
  "services_supported": [
    "Alarm Monitoring",
    "Fire Alarm Systems",
    "Inspection Services",
    "Installation",
    "Repair Services",
    "Testing & Certification"
  ],
  "emergency_definition": [
    "Active fire situation"
  ],
  "emergency_routing_rules": {
    "who_to_call": [
      {
        "name": "On-call technician"
      },
      {
        "name": "main office"
      }
    ],
    "call_order": [],
    "fallback": "Notify dispatch team"
  },
  "non_emergency_routing_rules": {
    "during_hours": "Transfer to office/front desk",
    "after_hours": "Collect caller details and confirm follow-up during business hours"
  },
  "call_transfer_rules": {
    "timeout_seconds": 30,
    "max_retries": null,
    "failure_message": "I wasn't able to reach the on-call technician directly. I'll dispatch your request and someone will contact you as soon as possible."
  },
  "integration_constraints": [],
  "after_hours_flow_summary": "Caller reaches Clara after business hours. Clara greets the caller and acknowledges after-hours status. Clara asks for the purpose of the call. Clara determines if this is an emergency. If EMERGENCY: Clara immediately collects name, callback number, and location/address. Clara attempts to transfer to on-call personnel (On-call technician, main office). If transfer fails, Clara assures the caller that someone will call back shortly. If NOT EMERGENCY: Clara collects details and confirms follow-up during next business day. Clara asks if there's anything else needed. Clara closes the call.",
  "office_hours_flow_summary": "Caller reaches Clara during business hours. Clara greets the caller professionally. Clara asks for the purpose of the call. Clara collects the caller's name and callback number. Clara attempts to transfer to appropriate party (On-call technician, main office). If transfer fails, Clara takes a detailed message and confirms follow-up. Clara asks if there's anything else needed. Clara closes the call professionally.",
  "questions_or_unknowns": [],
  "notes": "Phone numbers mentioned: 800-555-0999, 404-555-0145, 404-555-0260, 404-555-0188, 404-555-0250",
  "source_type": "onboarding",
  "version": "v1",
  "extraction_method": "rule_based"
}