{
  "account_id": "acct_guardian_mechanical__3dd243b9",
  "company_name": "Guardian Mechanical",
  "business_type": "mechanical",
  "business_hours": {
    "days": "Monday through Friday",
    "start": "7:00 AM",
    "end": "4:30 PM",
    "timezone": "Central"
  },
  "office_address": "889 Commerce Drive, Elk Grove Village, Illinois 60007",
  "services_supported": [
    "24/7 Emergency Response",
    "HVAC Services"
  ],
  "emergency_definition": [
    "Gas leak",
    "No A/C (summer emergency)",
    "No cooling",
    "No heat",
    "No heat (winter emergency)",
    "gas smell",
    "no heat",
    "things like no heat in winter — that's a big one for commercial buildings, it can freeze pipes"
  ],
  "emergency_routing_rules": {
    "who_to_call": [
      {
        "name": "On-call technician"
      },
      {
        "name": "owner"
      },
      {
        "name": "office manager"
      },
      {
        "name": "dispatcher"
      }
    ],
    "call_order": [],
    "fallback": "Notify dispatch team"
  },
  "non_emergency_routing_rules": {
    "during_hours": "Transfer to office/front desk",
    "after_hours": "Collect caller details and confirm follow-up during business hours"
  },
  "call_transfer_rules": {
    "timeout_seconds": 45,
    "max_retries": null,
    "failure_message": "I wasn't able to reach the on-call technician directly. I'll dispatch your request and someone will contact you as soon as possible."
  },
  "integration_constraints": [],
  "after_hours_flow_summary": "Caller reaches Clara after business hours. Clara greets the caller and acknowledges after-hours status. Clara asks for the purpose of the call. Clara determines if this is an emergency. If EMERGENCY: Clara immediately collects name, callback number, and location/address. Clara attempts to transfer to on-call personnel (On-call technician, owner, office manager, dispatcher). If transfer fails, Clara assures the caller that someone will call back shortly. If NOT EMERGENCY: Clara collects details and confirms follow-up during next business day. Clara asks if there's anything else needed. Clara closes the call.",
  "office_hours_flow_summary": "Caller reaches Clara during business hours. Clara greets the caller professionally. Clara asks for the purpose of the call. Clara collects the caller's name and callback number. Clara attempts to transfer to appropriate party (On-call technician, owner, office manager, dispatcher). If transfer fails, Clara takes a detailed message and confirms follow-up. Clara asks if there's anything else needed. Clara closes the call professionally.",
  "questions_or_unknowns": [],
  "notes": "Phone numbers mentioned: 847-555-0301, 847-555-0177, 847-555-0188, 847-555-0300",
  "source_type": "onboarding",
  "version": "v2",
  "extraction_method": "rule_based"
}