{
  "account_id": "acct_apex_fire_protection_10ea9a3c",
  "company_name": "Apex Fire Protection",
  "business_type": "fire protection",
  "business_hours": {
    "days": "Monday through Friday",
    "start": "7:30 AM",
    "end": "5:00 PM",
    "timezone": "Central"
  },
  "office_address": "4521 Industrial Boulevard, Suite 200, Arlington, Texas 76017",
  "services_supported": [
    "Alarm Monitoring",
    "Backflow Prevention",
    "Fire Alarm Systems",
    "Fire Extinguisher Service",
    "Fire Protection",
    "Fire Sprinkler Systems",
    "Inspection Services",
    "Kitchen Hood Systems",
    "Sprinkler Systems",
    "Suppression Systems",
    "Testing & Certification"
  ],
  "emergency_definition": [
    "Active fire situation",
    "Flooding",
    "Sprinkler system leak",
    "flooding",
    "sprinkler leak"
  ],
  "emergency_routing_rules": {
    "who_to_call": [
      {
        "name": "On-call technician"
      },
      {
        "name": "main office"
      }
    ],
    "call_order": [],
    "fallback": "Route to phone tree"
  },
  "non_emergency_routing_rules": {
    "during_hours": "Transfer to office/front desk",
    "after_hours": "Collect caller details and confirm follow-up during business hours"
  },
  "call_transfer_rules": {
    "timeout_seconds": 30,
    "max_retries": null,
    "failure_message": "I apologize, I'm unable to transfer you right now. Let me take your information and make sure someone gets back to you promptly."
  },
  "integration_constraints": [
    "Never create certain job types in ServiceTrade (confirm specific types)",
    "Never create sprinkler jobs in ServiceTrade",
    "ServiceTrade: sprinkler jobs automatically"
  ],
  "after_hours_flow_summary": "Caller reaches Clara after business hours. Clara greets the caller and acknowledges after-hours status. Clara asks for the purpose of the call. Clara determines if this is an emergency. If EMERGENCY: Clara immediately collects name, callback number, and location/address. Clara attempts to transfer to on-call personnel (On-call technician, main office). If transfer fails, Clara assures the caller that someone will call back shortly. If NOT EMERGENCY: Clara collects details and confirms follow-up during next business day. Clara asks if there's anything else needed. Clara closes the call.",
  "office_hours_flow_summary": "Caller reaches Clara during business hours. Clara greets the caller professionally. Clara asks for the purpose of the call. Clara collects the caller's name and callback number. Clara attempts to transfer to appropriate party (On-call technician, main office). If transfer fails, Clara takes a detailed message and confirms follow-up. Clara asks if there's anything else needed. Clara closes the call professionally.",
  "questions_or_unknowns": [],
  "notes": "Phone numbers mentioned: 817-555-0142, 817-555-0100, 817-555-0198, 817-555-0156",
  "source_type": "onboarding",
  "version": "v2",
  "extraction_method": "rule_based"
}