{
  "account_id": "acct_apex_fire_protection_10ea9a3c",
  "company_name": "Apex Fire Protection",
  "business_type": "fire protection",
  "business_hours": {
    "days": "Monday through Friday",
    "start": "",
    "end": "",
    "timezone": "Central"
  },
  "office_address": "",
  "services_supported": [
    "Alarm Monitoring",
    "Backflow Prevention",
    "Fire Alarm Systems",
    "Fire Extinguisher Service",
    "Fire Protection",
    "Fire Sprinkler Systems",
    "Inspection Services",
    "Kitchen Hood Systems",
    "Sprinkler Systems",
    "Suppression Systems",
    "Testing & Certification"
  ],
  "emergency_definition": [
    "Active fire situation",
    "Sprinkler system leak",
    "sprinkler leak"
  ],
  "emergency_routing_rules": {
    "who_to_call": [
      {
        "name": "On-call technician"
      },
      {
        "name": "office manager"
      }
    ],
    "call_order": [],
    "fallback": "Leave voicemail and assure callback"
  },
  "non_emergency_routing_rules": {
    "during_hours": "",
    "after_hours": ""
  },
  "call_transfer_rules": {
    "timeout_seconds": null,
    "max_retries": null,
    "failure_message": "I wasn't able to connect you directly. Let me take your information and someone will call you back shortly."
  },
  "integration_constraints": [
    "Never create sprinkler jobs in ServiceTrade"
  ],
  "after_hours_flow_summary": "Caller reaches Clara after business hours. Clara greets the caller and acknowledges after-hours status. Clara asks for the purpose of the call. Clara determines if this is an emergency. If EMERGENCY: Clara immediately collects name, callback number, and location/address. Clara attempts to transfer to on-call personnel (On-call technician, office manager). If transfer fails, Clara assures the caller that someone will call back shortly. If NOT EMERGENCY: Clara collects details and confirms follow-up during next business day. Clara asks if there's anything else needed. Clara closes the call.",
  "office_hours_flow_summary": "Caller reaches Clara during business hours. Clara greets the caller professionally. Clara asks for the purpose of the call. Clara collects the caller's name and callback number. Clara attempts to transfer to appropriate party (On-call technician, office manager). If transfer fails, Clara takes a detailed message and confirms follow-up. Clara asks if there's anything else needed. Clara closes the call professionally.",
  "questions_or_unknowns": [
    "Office address not provided"
  ],
  "notes": "",
  "source_type": "demo",
  "version": "v1",
  "extraction_method": "rule_based"
}