{
  "account_id": "acct_patriot_alarm_and_se_548cbce3",
  "company_name": "Patriot Alarm and Security",
  "business_type": "fire protection",
  "business_hours": {
    "days": "Monday through Friday",
    "start": "8 AM",
    "end": "5 PM",
    "timezone": "central"
  },
  "office_address": "",
  "services_supported": [
    "Alarm Monitoring",
    "Fire Alarm Systems",
    "Inspection Services",
    "Installation",
    "Repair Services"
  ],
  "emergency_definition": [
    "Active fire situation"
  ],
  "emergency_routing_rules": {
    "who_to_call": [
      {
        "name": "receptionist"
      }
    ],
    "call_order": [],
    "fallback": "Take a detailed message and assure callback within the hour"
  },
  "non_emergency_routing_rules": {
    "during_hours": "Transfer to office/front desk",
    "after_hours": ""
  },
  "call_transfer_rules": {
    "timeout_seconds": null,
    "max_retries": null,
    "failure_message": "I apologize, I'm unable to transfer you right now. Let me take your information and make sure someone gets back to you promptly."
  },
  "integration_constraints": [],
  "after_hours_flow_summary": "Caller reaches Clara after business hours. Clara greets the caller and acknowledges after-hours status. Clara asks for the purpose of the call. Clara determines if this is an emergency. If EMERGENCY: Clara immediately collects name, callback number, and location/address. Clara attempts to transfer to on-call personnel (receptionist). If transfer fails, Clara assures the caller that someone will call back shortly. If NOT EMERGENCY: Clara collects details and confirms follow-up during next business day. Clara asks if there's anything else needed. Clara closes the call.",
  "office_hours_flow_summary": "Caller reaches Clara during business hours. Clara greets the caller professionally. Clara asks for the purpose of the call. Clara collects the caller's name and callback number. Clara attempts to transfer to appropriate party (receptionist). If transfer fails, Clara takes a detailed message and confirms follow-up. Clara asks if there's anything else needed. Clara closes the call professionally.",
  "questions_or_unknowns": [
    "Office address not provided"
  ],
  "notes": "",
  "source_type": "demo",
  "version": "v1",
  "extraction_method": "rule_based"
}