{
  "account_id": "acct_summit_electric_e6f7b3e0",
  "company_name": "Summit Electric",
  "business_type": "electrical",
  "business_hours": {
    "days": "",
    "start": "",
    "end": "",
    "timezone": ""
  },
  "office_address": "",
  "services_supported": [
    "24/7 Emergency Response",
    "Electrical Services",
    "Installation",
    "Maintenance",
    "Repair Services"
  ],
  "emergency_definition": [
    "Active fire situation",
    "things like power outages in occupied buildings, electrical fires or burning smells, sparking equipment, exposed wiring in public areas, and generator failures during power outages"
  ],
  "emergency_routing_rules": {
    "who_to_call": [
      {
        "name": "On-call technician"
      },
      {
        "name": "front desk"
      }
    ],
    "call_order": [],
    "fallback": "Notify dispatch team"
  },
  "non_emergency_routing_rules": {
    "during_hours": "Transfer to office/front desk",
    "after_hours": ""
  },
  "call_transfer_rules": {
    "timeout_seconds": null,
    "max_retries": null,
    "failure_message": "I wasn't able to reach the on-call technician directly. I'll dispatch your request and someone will contact you as soon as possible."
  },
  "integration_constraints": [],
  "after_hours_flow_summary": "Caller reaches Clara after business hours. Clara greets the caller and acknowledges after-hours status. Clara asks for the purpose of the call. Clara determines if this is an emergency. If EMERGENCY: Clara immediately collects name, callback number, and location/address. Clara attempts to transfer to on-call personnel (On-call technician, front desk). If transfer fails, Clara assures the caller that someone will call back shortly. If NOT EMERGENCY: Clara collects details and confirms follow-up during next business day. Clara asks if there's anything else needed. Clara closes the call.",
  "office_hours_flow_summary": "Caller reaches Clara during business hours. Clara greets the caller professionally. Clara asks for the purpose of the call. Clara collects the caller's name and callback number. Clara attempts to transfer to appropriate party (On-call technician, front desk). If transfer fails, Clara takes a detailed message and confirms follow-up. Clara asks if there's anything else needed. Clara closes the call professionally.",
  "questions_or_unknowns": [
    "Timezone not specified",
    "Office address not provided"
  ],
  "notes": "",
  "source_type": "demo",
  "version": "v1",
  "extraction_method": "rule_based"
}